,question_text,topics,answer_text,q_token_count,a_token_count,a_text_length,tf_type_zero_shot,tf_score
506,ive been dealing with this for years my mom thinks im overly emotional and refuses to offer any help like therapy or seeing a doctor shes seen me when im having a panic attack and just said i was faking for attention or that im a hypochondriac i just want to get better,anxiety,how old are youare you old enough in your state to have therapy without your mothers consentyour moms attitude toward you may be one significant reason on why you feels so much tension in the first placedont let her opinions and beliefs get in the way of what you know about yourselfare you in school and does that school have a guidance counselorwould you talk with that person about your difficult getting your mom to retain helping services for youkeep looking for local resources which will support you either directly or indirectly by advocating for your right to receive mental health care,1,1,595,T,0.70365309715271
2677,"im concerned about my  year old daughter 

about a month or two ago she started walking on her toes as well as coloring and writing very messy this all happened very suddenly she has never walked on her tiptoes and has always colored and written very neatly 

is this something i should be concerned abou any advice will help",parentingchildren  adolescents,have you asked your daughter why shes doing the behaviors you describeoften the best way to find out why someone does something is to simply ask them their reasonher answer will give you some guidance as to next possible stepsif shes pretending to be a fantasy figure or trying to find out how being taller feels or walking on high heels or some other image then knowing this rules out that she has some unbearable pain in her arch which may require more practical answers such as new shoes or even indicate a medical problemask if shes noticed any change in the way she walks   maybe she doesnt know shes doing this and maybe she feels embarrassed to tell you shes doing something a bit oddsince usually  year olds dont color is it new that she started coloringmaybe given the fact of messy handwriting shes in a phase of pretending or reflecting on good times as a young childthen this becomes the topic of examinationdoes she feel insecure about being on the cusp of adolescencesome of these questions can be asked directly and some are for you to first decide based on what you know of your daughter which questions and what direction to take in understanding your daughters motivation,1,1,1189,T,0.5297539234161377
681,my exhusband told my two adolescents that santa doesnt exist on the day before christmas they are desperate to hold on to the magic of christmas but i dont know if its right for me to lie to them and tell them that santa is real i dont want to let them down and make them lose out on those memories but i also dont want to lose their trust,parenting,well boise the cats out of the bag now isnt it i love that you want to help your kids keep the magic of christmas they must want that too if they still believe in santa into their teen years which is unusual i believe i wonder if they had already figured it out anywaybut they know now and your ex had the right to tell them if he felt it was best so its time to explain to them what a loving and magical thing it is that parents do and christmas can still be magical in so many ways really who says they have to stop believing in santa santa is very real as a spirit of surprise generosity and love,1,1,599,T,0.5339271426200867
1587,they discontinued treatment for no apparent reason after they thought to diagnose me with schizophrenia,legalregulatory,the general rule against medical abandonment says thst whenever healthcare providers discontinue treatment with you when you still need it they are legally required to make sure that you have access to another provider of equal or higher abilityin this case if your treatment team decided to discontinue your treatment based on a diagnosis of schizophrenia they still will likely be required to provide you with a referral to someone who can provide you with treatment if you havent already done so id recommend that you explicitly ask for a referral,1,1,550,T,0.8440921902656555
314,im in a state of depression right now who can i talk to ive been sick in a lot of pain and crying dont know where to turn,depression,first of all if youre sick and in pain have you seen your doctor if you have a chronic illness and pain this can often lead to depression and is very common youve taken the first step to dealing with it you can talk to your doctor even if your depression isnt related to your health he or she can either look at prescribing you an antidepressant or can refer you to a psychologist or psychiatristif thats not really an option for you there are also helplines local or national or support groups where people dealing with similar issues can talk to each other if you cant find any in your area newspapers usually publish this information there are online support groups as well,1,1,676,T,0.656501293182373
810,my husband and i got into a huge dispute he said he wanted a divorce and i left i still come home a lot and see my kids and he has not filed yet even though he still said he is what does that mean for our marriage,relationshipdissolution,in any relationship including marriage each partner will be better able to do their part by understanding their own interests and wishesconcentrate more on what youd like from your marriage  this will naturally raise the questions and criteria of what to talk with your husband about and what to ask of himthink over whether you wish to divorce or notsince he hasnt taken any action then for the moment you can assume he is not sure of what he wantsonce you feel a little more clear on your opinion about your marriage including feeling uncertain if youd like it to end or continue then you will be able to tell your husband the suggestions you have for resolving the dispute matter and emotionstry to redirect your speculations about what does he want i wonder what hes thinking back to answering these very reasonable questions about yourselfthis will strengthen your own purpose in clarifying where to start and guide a discussion with himgood luck,1,1,951,T,0.5262665152549744
1547,i cant understand what i pay attention to,behavioralchange,one way to concentrate is that if your mind starts to wonder then remind yourself to bring your attention backstart with short time spans of expecting yourself to concentrate  youll more likely succeed with concentrating with small time spans than longer onesonce you start seeing your success this will motivate you to try increasing the length to expect yourself to concentratethe task of selfreminding is the same whether for long or short time periodsalso before starting this exercise ask your medical doctor if the problem can be related to a physical health problemif there is then have the possibility ruled out that your difficulty concentrating comes from the mental ability to concentrate and not some medical reason preventing thisbefore someone can engage their psychological will there must be a clean medical body and mind with which to work,1,1,856,T,0.655473530292511
