,question_text,topics,answer_text,q_token_count,a_token_count,a_text_length,tf_type_zero_shot,tf_score
277,i think i may suffer from depression and it is affecting my life and sleep i am on my parents insurance and they wont let me see a therapist because they dont believe in it,depression,the answer here really depends upon your age and something called the age of consent in the state where you live in pennsylvania anyone over the age of  can provide consent for their own treatment as for billing purposes try talking to some local agencies if you are under  you may be able to have medicaid out of medical necessity so that you can have treatment if you are over  there may be some discounted rates at some agencies because of the situation youre in maybe your primary care physician will be able to refer you to some local agenciesif you are in school you may be able to talk with a guidance counselor or someone at the school this would not require using your insurance,1,1,687,T,0.6971882581710815
733,im scared that i am with this man so i wont be alone he should be with somebody who deserves him if this is the case and i dont want to hurt him,selfesteem,while not wanting to be alone may not be the best reason to be in a relationship it is probably more common and normal a reason than you think  since you seem to care about your friend dont want to hurt him i imagine there are many other reasons that you are together  i suggest that you talk about this openheartedly with each other  the idea of being afraid of being alone sounds like an honest starting place  dont try to figure out whether you should be with him  just talk  the communication is likely to shine light on deepening connection for both of youin the meantime your idea that you dont deserve him is rooted in a core lie that you are telling yourself  you can read about core lies and much more in my book living yes a handbook for being human  check out wwwlivingyesorgbe easy on yourself  you are deservingmark,1,1,828,T,0.6491724252700806
1104,ive been in a relationship for almost a year and i absolutely trust my boyfriend he treats me nice checks on me and tells me sweet things however when it comes to making life decisions i feel he is very immature i try to talk things out so we can compromise or make sound decisions together but he lacks any ideas and prefers to just go with anything to avoid fighting as far as dates if i dont say anything plan it or have money to chip in we will not go i feel like i put in a lot of work supporting and sometimes spoiling and all i get is a loyal man who will not cheat and say sweet things on occasion,intimacy,well then your decision is whether you want to stay in this type of relationship or notone point to keep in mind is thisjust because hes not telling you his opinions doesnt mean he doesnt have any opinionsin the long run t is always easier to talk with someone about their differences from our point of view than to be someone who doesnt tell you what is in their mindshort term it seems easy to have someone agreeablelong term someone who doesnt tell you their thoughts and who disagrees with you may potentially go about their true wishes in hidden ways,1,1,555,T,0.5735355019569397
2666,"i have a friend that who i used to be in a relationship with it was brief and turned into us being just good friends

i spent the weekend with him and  it upset my boyfriend was i wrong",relationshipssocial relationships,thank you for submitting this question i think this type of situation can be common for many couples struggling with how to keep friendships with past relationships while being in a new relationship for me more information is needed herebut given the information provided the way i interpret the question isim assuming your boyfriend didnt know you were going to spend the weekend with your good friend  working off of this assumption i would suggest beginning an open and honest dialogue with your boyfriend about what specifically upset him and to talk about your point of view regarding spending the weekend with him i would also suggest talking about how you both envision your relationship when it comes to spending time with others if you feel like you cant have this conversation without it going off track please consider seeing a couples therapist they can help you begin these important conversations that can help shape and develop the relationship you and your boyfriend long for,1,1,991,T,0.8833264708518982
1571,i just need to know if im really crazy or not,behavioralchange,do an internet research on psychosis symptoms and see if you have several of the symptoms  if you do seek a medical evaluation from your primary care physician  there are great medications and psychotherapy that can help you live your life to the fullest  there a many people who are diagnosed with psychosis and living a productive life,1,1,337,T,0.6287834048271179
1476,my exboyfriend and i met over a year ago we hit it off and fell in love pretty quick however he has trust issues and assumed i was cheating when i found out i was pregnant we had just broken up five months later i lost the baby and we did not speak for a few weeks now we are talking and he says he loves me but is afraid i will hurt him again i just want to know where to go with this because i love him so much and i want to get back to us being happy and a family,relationships,trust is essential in romantic relationships and it is common to have trust issues  because the stakes are so high if both of you are committed and willing to be fully honest with each other trust can be repaired and become stronger than ever i would encourage you to seek out professional help as it easy to get derailed by fear when trying to work things out in the absence of trust when fear takes over  we tend to become defensive and act in ways that makes it harder to trust one another in addition to getting professional support i would encourage you to learn more about building trust in relationships and deepening connection through accessing various online resources on relationships,1,1,695,T,0.64729905128479
1148,we got into arguments and we would break if off but start it back up again we clicked or so i thought we are both married with problems in our marriage we never have sex we just send a lot of pictures back and forth and talk about doing things together his wife found out and he lied to her and didnt even refer to it as an affair i cant stop thinking about him we just click ive been married for  years and ive never liked anyone other than my husband now i like him and well never be together,intimacy,if you will never be together and in order to maintain this affair you need to deceive both of your spouses it seems unlikely that maintaining the affair will bring anything but heartbreak for everyone involved there is obviously something that you are getting from this that you are not getting in your marriage maybe this is a cue that there is work to do on your marriage to try to make it more fulfilling and if that is not possible then maybe you want something else for your life  if you and your husband are willing i would encourage you to do some therapy or counselling together  you may enjoy this article to learn a little more about some factors that lead to connection or disconnection and that predict separation and divorce,1,1,738,T,0.6652579307556152
239,i have a severe back problem ive had  major and several minor operations but im still in constant pain how can i deal with the depression from this chronic pain,depression,chronic pain at the back likely results from a few areasll kidney zone most likely lower backbone spurs fused discs and slipped discs caused by connective tissue weakness and calcium deposits used to neutralize highly acidic areasthe depression will evaporate when the chronic pain is drained out through natural meanspharmaceutical means will simply extend the pain and cause it to deepen over time not solving the problemremember medical doctors suppress natural doctors cure,1,1,477,T,0.8375306725502014
1213,my new daughterinlaw just informed me that she is smoking marijuana while pregnant because of her morning sickness im in shock and i dont know how to respond i just lost my mom and she was good with advice,substanceabuse,have you reached your own conclusions and reasons for these regarding the topic   when you feel confident in your own reasons for your conclusions then obviously ask your daughter in law for some time together and tell her what you think and your reasons for opinionsplan for this meeting according to the type of relationship you have with your daughter in lawsince your son will also be affected by the prenatal conditions of his child he may also be interested in being part of this conversationalso during your discussion find out the exact ways the morning sickness affects your daughter in lawit is possible that scheduling adjustments in routines can be made so your daughter has more time to rest or fewer responsibilities for a while until she feels bettermaybe you and other family members can lighten her daily routines so she has more time for herself to manage her morning sickness in a less risky waysending good luck,1,1,931,T,0.5475773215293884
210,im in my early s ive worked since two months after i turned  i have plans i could become an electrician or i could operate heavy machinery i have goals but i do nothing to try to meet them because i dont feel i can i just want a better life for my fiancée and the kids than i did,depression,if youre not following the goals you gave yourself there are two possibilitiesyou dont really like your goalsyou selfsabotage and prevent yourself from your own strengths and accomplishmentsthink through each of theseif youve set goals which arent true to your nature then intuitively some part of you will reject themif you selfsabotage get in your own way from achieving what you truly would like then ask questions of yourself around whether you feel undeserving of success,1,1,476,T,0.7627803087234497
207,i dont know if i have depression but i have been very sad there are nights that i dont sleep i dont eat all day sometimes i dont have energy to anything anymore,depression,these symptoms are all classic to the diagnosis of depressiona diagnosis itself doesnt help anyone get better  often people say the word depression as though it means something terrible   the diagnosis of depression can be depressingforget matching symptoms with a diagnosismore important to improvement is to know the reason for your sadness  when people become sad there is a reason for it and knowing this reason is the first step to changing the situation which creates the sadness in youthink of depression as a way to slow down and examine aspects of your life and relationships  if you continue at the same pace of living and didnt stop and examine your life then you may not notice what needs changing,1,1,709,T,0.5042861700057983
677,my daughter didnt see her biological father for the last three years she doesnt want to see him because she remember really bad things from him such as domestic violence and child abuse the visitation is with supervision but she refuses to see him is it better to take my daughter to the therapist and try to see him after the therapy,parenting,has the father or the visitation supervisor contacted you regarding why your daughter hasnt shown up for the past three years worth of supervised visitationor is the supervised visitation a new development for the bio dad and your daughterif no one is pressuring or expecting your daughter to show up no one has even asked where she is why she isnt present then i dont see any reason for you to offer more effort by your daughter than the father is willing to make for seeing herif your daughter is willing to talk with a therapist then let her find out first hand if the sessions seem useful or notthe one move id avoid is to force your daughter to go to a therapist since growing up in a household in which child abuse took place being forced may remind her of her own feelings from this past of feeling no one heard or cared about the way she wanted to be treated,1,1,866,T,0.6300588846206665
1131,weve been dating for two months now i have a heavy past that gets him angry does he have a right to penalize me for things i did before i met him,intimacy,not in my book youre only two months in at this early stage this is a bit of a warning sign if he cant accept or feel comfortable with who you are and decisions youve made theres already a level of discomfort here that shouldnt be ignored no he doesnt have the right to penalize you or punish you not just for past thingsnot for anything what he does get to do it tell you how it affects him sureif he feels uncomfortable or needs reassurancelisten to those things but if he doesnt dig who you are maybe he can walk the other way,1,1,529,T,0.5429062843322754
1261,my mom and dad got divorced four years ago i had to finish out the school year with my dad and now they are deciding which place is best for me i cant choose how can i choose if i love both places,familyconflict,if youve already stated to your parents that youd like your opinion to be considered and listed the key areas youd like them to keep in mind when making a final decision as to which house you will live then youve done all you possibly and reasonably can dosince you wrote that you have difficulty to decide in which parents home you prefer to live then even if you had free choice of whose house in which to live are you not better off with the decision made by them on your behalf,1,1,481,T,0.7892454266548157
686,what makes my step child an  year old boy choke my daughter a  year old girl this has been going on for  years the boy tells my daughter not to tell on him he knows its wrong we have did time out spanking taking away toys and sitting on the wall i am afraid for my daughters safety,parenting,i can see why you are alarmed that is a scary situation for a parent do you know if the child has been evaluated by a mental health professional early treatment is often the key a professional will be able to help the child learn how to control their anger and mend the troublesome actions into more appropriate responses have you addressed your concerns with the childs other parent there could be contributing factors in his life that could be causing these issues exposure to violence sexualphysical abuse drug use stressful events in his life etc it is important that these factors are identified so that they can either be eliminated andor reduced i wouldnt hesitate to have him evaluated if he hasnt been already and to ensure that he is getting the help that he needs whether it be medication andor therapy until then i would make sure that he is always supervised under an adults care,1,1,892,T,0.5901259183883667
1233,my mother takes care of niece whom my sister abandoned she calls me every day complaining but i dont want to hear it anymore,familyconflict,then one day when life between you and mom feels calm tell your mom that you arent able to listen to her complaints about your sisterthe truth exists whether or not it is acknowledged   bu acknowledging what feels real and necessary in your life you are helping your mom see what she may not like to see and what nevertheless is right in front of herthere is no good reason or good to come of hiding your own truth about not wishing to continue listening to your mom complain,1,1,475,T,0.5911526679992676
635,my daughter is in later elementary school she cant color in the lines her words jumble together when she writes unless there are big spaces or she skips lines,parenting,at times when a child is not displaying milestone behavior at the same rate that is average for their peers this should raise concern so you are correct in reaching out for advice speaking with your childs pediatrician as well as school staff may be the first places to start you can request that she receive an assessment and evaluation with a subsequent treatment plan to meet any needs she may have,1,1,401,T,0.798875093460083
978,any time things get heated the past gets brought up i raise my voice at her to try to get a point across she asks openended questions but always has to turn my own answer against me shes seven months pregnant i have drank in the past but im not dependent on alcoholi only drink at social events,angermanagement,have you tried to talk about the subjects of the past in the present at a time in which there is no heat between the two of yousince your gf would like to resolve situations from the past the best way to do so would be to talk about them  the more you try to avoid certain subjects the more likely they will come up between you at worse possible momentsif you can get ahead of the pattern of old topics coming up without your control then try scheduling a discussion about them  this by itself will show your gf you care about what she cares about and this may be one quality she would feel good about,1,1,601,T,0.544616162776947
374,im dealing with imposter syndrome in graduate school i know that by all accounts i am a phenomenal graduate student and that i am wellpublished i am well liked by students and faculty alike and yet i cannot shake the feeling that im going to be found out as a fraud    how can i get over this feeling,anxiety,it sounds like you are on the right track recognizing these nagging thoughts of self doubt as imposter syndrome is a huge step in the right direction  from what you have written here it appears that you are able to challenge your own thoughts and provide yourself with evidence that counteracts the imposter syndrome   continuing to remind yourself of what you have accomplished and looking at the facts at hand can help diminish doubt  remember many successful people battled imposter syndrome on the way to the top and still manage it  it might be helpful to read some of their stories so that you dont feel alone  the cut has a great article on  famous women on impostersyndrome and selfdoubt   business insider has a great article about men and the imposter syndrome too  remember if you jumped through all of the hoops to get into school and get published you belong,1,1,871,T,0.5293518304824829
1567,"i was with my friends fishing by a pond i found a frog and stabbed it with my friends knife im not sure why i did it my friends saw me do it it and were shocked and got really mad at me
   now if someone brings it up i get really upset and panicked i dont know why i feel like this does this mean there is something wrong with me",behavioralchange,the good news is your awareness that being violent to animals feels out of character for you   im glad you have awareness and im glad you are not at ease with killing frogsfairly likely that you were acting out aggressively toward the frog feelings of being on the receiving side of similar type of violencebasically you did unto the frog what someone has or to you feels like has been done to youuse your surprising finding of how strong your anger and most likely inward pain   reflect on your closest relationships and how these people treat you   it is possible you feel more hurt by someone who is close to you than you ever realizedstabbing innocent frogs is wrong  it is understandable as a way to show you how much inner pain you probably haveit is also wrong that someone close to you hurt youthe direction to go is to recognize your pain and then decide how to go about changing what is possible on your side of that or those relationships,1,1,949,T,0.5982456207275391
959,ive been with my boyfriend over  years he cheated on me and the woman is now pregnant he is physically and mentally abusive towards me i have attempted to talk with him in order to resolve our issues however he never wants to talk and often blames me for everything im always there when he needs my help he tells me although i help him doesnt mean that i am a good person he always discredits me as a woman and its hurtful i spend most day crying and feeling lonely i am unhappy and unsure of what i need to do,domesticviolence,that sounds like a very hurtful situation unfortunately without a batterers intervention course or a desire to change the abuse cycle is unlikely to stop i do not recommend that you try to leave on your own due that being the most dangerous time when in an abusive relationship as an abuser his goal is to control you whether its through mental or verbal means i recommend that you contact a domestic violence shelter in your area i have worked closely with harbor house of central florida and know they provide housing transportation and any other needed resources to women leaving an abusive relationship there is help out there and you are not alone if you need any additional resources in your area please dont hesitate to contact me,1,1,737,T,0.6567085981369019
1963,"my therapist is gay so there are no sexual issues here however my therapist for six years has made me believe that he cares about me and that we are friends i have loaned money to him many times and he always paid me back

i had a medical emergency last weekend and i was heavily medicated i knew that this therapist came into my home and wrote down my credit card information so he could pay back what he owed me but this therapist dropped me off and never came again  i dont know what to do",professional ethics,im sorry to hear that this has happened counselors are legally and ethically required to make sure that they always put the wellbeing of their clients above their own interests in addition counselor ethical rules and the laws in just about every state make it illegal for counselors to take advantage of a client financially a counselor borrowing money from a client even if the counselor pays it back would usually be considered to be taking advantage of the clientthere are a few options you have at this point if you cant or dont want to continue to try to contact him directly you can file a complaint with your states regulatory board and let them know what has happened  an investigator will then look into the situation for you  another option would be for you to find a different counsleor who can provide you with an independent and netural point of view to help you figure out how you want to handle this situation,1,1,924,T,0.7664909362792969
2470,sometime when small thing happen like losing a comb i get furious  i even start throwing things do i have a problem,anger management,anyone who asks whether or not they have a problem usually feels at least partly that they do have a problemyour answer to the question is what matterssince you already understand that your reaction is overstated to the events which trigger them the reactions youre having are more than likely anger that is leftover from past events either in the near or distant pastbe aware consider reflect on  how you usually handle feeling angry  based on your description here it is quite likely that the anger you show toward what you call little things reflect anger at much bigger matters that are uncomfortable and not easy to understandknowing more about the more significant matters causing frustration for you may very likely decrease reacting angrily toward smaller matters,1,1,771,T,0.5169387459754944
1268,i have a mother who is still running my life even though im almost  years old i want to move out and live my own life but it feels like as long as i do what my mom wants our relationship is okay its never okay if i dont do what she wants    i dont know how to start making my own decisions and not worry about whether its right in her eyes would it help for me to talk to someone about this,familyconflict,if the only way the relationship you have with your mother feels okay is when she is the only one who makes decisions concerning your life then this only seems okin fact it is not okay for one person to be the authority for another person unless the one for whom this is being done does not have their own ability to think for themselvesseparating your own wishes and way of handling life matters from your mothers point of view may be difficultfirst realize you need to get familiar with feeling at ease with the idea of deciding matters for yourselfyoull need practice until you feel comfortableunless if youve been thinking through decisions youd like to make and the idea of your mothers anger is the only point which stopped you then you may almost instantly start living in a liberated way of running your own lifebasically it is right and fair for you to have the chance to live your life the way you feel is best   be prepared that your mother may disagree with you and that her disagreement is not a reason itself to not do what you believe is in your best interest,1,1,1074,T,0.5551788210868835
1147,my partner and i have had an amazing relationship and connection for over two years were very committed to each other and are planning a very long life together however he recently was very open and honest that he isnt interested in having sex with me anymore he says this has happened in every past relationships and has ended it as a result he knows its because its the same person feeling but how can he get over this,intimacy,i wonder how long anymore will be for your boyfriendsince you both are planning a long life together instead of his custom of ending relationships when he feels bored with the sex he will be facing the situation of being in a relationship and not having sex with his partner to whom he is committedwhat are your own views on the meaning of sex in a relationshipknowing this will help you be better able to collaborate with your boyfriend on finding ways of balancing what you each would like,1,1,491,T,0.7991546392440796
